{
  "accountId": "unassigned-test-account",
  "platform": "qq",
  "adapterVersion": "napcat-v4.18.28-candidate",
  "observedAt": "2026-09-24T00:00:00.000Z",
  "receiveTypes": ["text", "image", "voice", "unsupported"],
  "sendTypes": ["text"],
  "receiptLevels": ["accepted"],
  "ownerMessageSignal": "documented:message_sent",
  "historySync": "unknown",
  "mediaFetch": "documented:get_image/get_record",
  "constraints": [
    "候选桥未安装、未登录、未接收任何真实事件；本文件是 spike 输入，不是能力结论",
    "accountId 为占位值：真实测试账号选定后必须换成已登记 PlatformAccount 的内部 UUID 并重新签发",
    "NapCat 许可为受限许可，个人测试使用权限需在安装前核清；不复制、修改或再分发其代码",
    "事件推送用配置里的 token 作为 HMAC-SHA1 签名密钥（x-signature: sha1=...）并带 x-self-id；部署仍必须保持私有网络且不暴露端口"
  ],
  "verificationStatus": "unknown",
  "evidence": [
    {
      "capability": "receive_types",
      "status": "documented",
      "sourceRef": "https://napneko.github.io/develop/event",
      "observedAt": "2026-09-24T00:00:00.000Z",
      "adapterVersion": "napcat-v4.18.28-candidate",
      "constraints": ["仅维护者文档声明私聊/好友事件与消息段；逐类型实际送达、顺序、去重与原始字节完整性均未实测",
        "本适配器只声明 text、image、voice、unsupported：表情段（face）与未知段记为 unsupported，image 段一律记 image 而不认作静态或动态表情，因此不声明 sticker_static/sticker_animated",
        "动态表情能否取得完整动画序列、而非单帧，仍待真实样本实测"]
    },
    {
      "capability": "send_types",
      "status": "documented",
      "sourceRef": "https://napneko.github.io/config/basic",
      "observedAt": "2026-09-24T00:00:00.000Z",
      "adapterVersion": "napcat-v4.18.28-candidate",
      "constraints": ["send_private_msg 为文档声明；发送窗口、频率限制与幂等键均未实测",
        "本适配器当前只声明 text：已批准表情发送需要 03 的素材读取端口，未接线前对 approved_sticker 一律返回 UNSUPPORTED_CAPABILITY，因此不声明 sticker 发送能力"]
    },
    {
      "capability": "receipt_levels",
      "status": "unknown",
      "sourceRef": "https://napneko.github.io/develop/event",
      "observedAt": "2026-09-24T00:00:00.000Z",
      "adapterVersion": "napcat-v4.18.28-candidate",
      "constraints": [],
      "unavailableReason": "无实测：当前只能把桥接成功回包记为 accepted，无法区分 accepted 与 delivered，也无法按 sendKey 查询超时后的结果"
    },
    {
      "capability": "owner_message_signal",
      "status": "documented",
      "sourceRef": "https://napneko.github.io/develop/event",
      "observedAt": "2026-09-24T00:00:00.000Z",
      "adapterVersion": "napcat-v4.18.28-candidate",
      "constraints": ["message_sent 事件已文档化，但缺少经审核的对端 mapper：本人手发与桥接回显的区分尚未验证，自己发出的事件当前会收到 400 而不是被归类"]
    },
    {
      "capability": "history_sync",
      "status": "unknown",
      "sourceRef": "https://napneko.github.io/config/basic",
      "observedAt": "2026-09-24T00:00:00.000Z",
      "adapterVersion": "napcat-v4.18.28-candidate",
      "constraints": [],
      "unavailableReason": "无实测：没有可证明的连续覆盖游标；断线重连后的补齐范围与是否丢消息均未测，RecoveryReport.historyComplete 只能为 false"
    },
    {
      "capability": "media_fetch",
      "status": "documented",
      "sourceRef": "https://github.com/botuniverse/onebot-11/blob/master/api/public.md",
      "observedAt": "2026-09-24T00:00:00.000Z",
      "adapterVersion": "napcat-v4.18.28-candidate",
      "constraints": ["get_image/get_record 返回桥接本机路径：跨主机可读性、URL/token 失效期、原图与原语音完整性、动态表情是否可取得完整序列均未实测"]
    }
  ]
}
